id,quote,author,category
103,"The goal is to turn data into information, and information into insight.",Eoghan McCabe,Analytics
104,"You want everyone to be able to look at the data and make sense out of it. It should be a value everyone has at your company, especially people interfacing directly with customers. There shouldn't be any silos where engineers translate the data before handing it over to sales or customer service. That wastes precious time.",Stewart Butterfield,Analytics
105,"We've tried to put passion and art and love and creativity ahead of revenue and valuation and buzz and traction, discovering that the latter can often follow the former.",Leo Widrich,Analytics
106,"Of course hard numbers tell an important story; user stats and sales numbers will always be key metrics. But every day, your users are sharing a huge amount of qualitative data, too — and a lot of companies either don't know how or forget to act on it.",Jackson Noel,Analytics
107,"We live in a time where data is all around us, and there's a lot of great advice to show us how to make better use of data. However, I've found that in some cases this can be a huge waste of time, especially early on with your startup. Replace some of your current focus on quantitative data to qualitative data).",Brian Chesky,Analytics
108,"The single most important thing we've done for onboarding is planning past the first session. Let's say you have a SaaS application and know that new users who take actions X, Y, and Z end up being really successful.",Kevin Systrom,Analytics
109,It's tempting to build a linear new user flow that encourages them to take these 3 actions then call it a day. But that's just not how humans evaluate software - most of them will hardly complete one of the three actions in their first session. [...],David Barrett,Analytics
110,"Planning past the first session matches your funnel to your buyer's decision making process. It means aligning your in-product experiences, email campaigns and sales/customer success outreach to reinforce the user's success path.",Mitch Lowe,Analytics
111,"The problem with Silicon Valley is when you build an app you are expected to make the app go viral and reach millions of people. This is the worst way to think about it — it's much better to get 100 people to love you. There was no way we could get 1M people on Airbnb, but we could get 100 people to love us. This is when we decided to do things that wouldn't scale. Getting 100 people to love you is hard — getting people to like you is much easier than getting people to love you.",Lloyd Tabb,Analytics
112,"I learned a lesson from watching other companies who held onto things too long. If you look at the history of companies that have succeeded and the ones that have failed, there's a pretty clear pattern that the ones that have succeeded typically morph every couple of years into something new. And that change is fairly uncomfortable.",Paul Graham,Analytics
113,"[For early-stage startups,] data is never there when you need it most. At best, data can help you make very small, incremental decisions. But if you're a startup, you're focused on big, broad swings — and data has no place in that. You don't have enough users to draw any meaningful conclusions, and even if you did those users aren't necessarily representative of your long term target audience. You've got data, sure. But not enough to make a genuine, data-driven decision, and pretending otherwise is a recipe for disaster.",Jessica Livingston,Analytics
114,Use analytics to make decisions. I always thought you needed a clear answer before you made a decision and the thing that he taught me was [that] you've got to use analytics directionally…and never worry whether they are 100% sure. Just try to get them to point you in the right direction.,Peter Levine,Analytics
115,Your metrics influence each other. You need to monitor how. Don't just measure which clicks generate orders. Back it up and break it down. Follow users from their very first point of contact with you to their behavior on your site and the actual transaction. You have to make the linkage all the way through.,Arjun Sethi,Analytics
116,"Venture capitalists have a unique perspective on business and analytics, because they evaluate from an outside perspective. Often becoming a VC after years of experience in business, investing, banking, or founding, a VC's future professional success depends on their ability to determine what will sink and what will swim.",Ben Horowitz,Analytics
117,"Churn, metrics, growth, and conversions are just some of the things that we've got on the record from VCs.",Jason Lemkin,Analytics
118,"Merely measuring something has an uncanny tendency to improve it. If you want to make your user numbers go up, put a big piece of paper on your wall and everyday plot the number of users. You'll be delighted when it goes up and disappointed when it goes down. Pretty soon you'll start noticing what makes the number go up, and you'll start to do more of that. Corollary: be careful what you measure.",Bill Gurley,Analytics
119,Your users are your guidepost. And the way you stay on the right path in the early stages of a startup is to build stuff and talk to users. And nothing else.,Cindy Alvarez,Analytics
120,"For predictive analytics, we need an infrastructure that's much more responsive to human-scale interactivity: What's happening today that may influence what happens tomorrow? A lot of iteration needs to occur on a continual basis for the system to get smart, for the machine to learn — explore the data, visualize it, build a model, ask a question, an answer comes back, bring in other data, and repeat the process. The more real-time and granular we can get, the more responsive, and more competitive, we can be.",Jonathan Hsu,Analytics
121,You must constantly try to disrupt yourself. The most successful companies embrace cannibalization at the core. [...]You need to innovate and be willing to threaten the core of your business in order to survive. Or you'll die!,Charles Babbage,Analytics
122,"I often see teams that maniacally focus on their metrics around customer acquisition and retention. This usually works well for customer acquisition, but not so well for retention. Why? For many products, metrics often describe the customer acquisition goal in enough detail to provide sufficient management guidance. In contrast, the metrics for customer retention do not provide enough color to be a complete management tool. As a result, many young companies overemphasize retention metrics and do not spend enough time going deep enough on the actual user experience. This generally results in a frantic numbers chase that does not end in a great product.",Michael O'Connell,Analytics
123,"Don't obsess over these sub metrics, but obsess over the key metrics that tie into your revenue growth. Everything can be measured, including engineering, PR, product and marketing. If you have your engineering team agree to measure the output of features quarter over quarter, you will get more features built. It's just a fact. You have to measure every functional area. Measure them all and have everyone agree to the same growth goals to support your revenue, and magical things will happen.",Edward Tufte,Analytics
124,"If an Internet company could obsess about only one metric, it should be conversion. No other metric so holistically captures as many critical aspects of a web site – user design, usability, performance, convenience, ad effectiveness, net promoter score, customer satisfaction – all in a single measurement. Yet despite the remarkable power of this metric, it is alarming how few companies today truly understand conversion and how to optimize it. As such, it is time to pound the table again – conversion is by far the most powerful Internet metric of all.",Authors of Made to Stick,Analytics
125,"Thought leaders, especially in the tech world, are focused on the possibilities in front of us and push everyone to get smarter, faster, and stronger. From world-class writers and researchers to data scientists that pioneer our methodological approaches, the analytics quotes from this group pretty much covers all the bases.",Avinash Kaushik,Analytics
126,"You don't need to learn what customers say they want; you need to learn how customers behave and what they need. In other words, focus on their problem, not their suggested solution.",Marli Mesibov,Analytics
127,"Data isn't useful without the product context. Conversely, having only product context is not very useful without objective metrics...",Daniel Gruhl,Analytics
128,Errors using inadequate data are much less than those using no data at all.,Sir Timothy John Berners-Lee,Analytics
129,"When you are dealing with a torrent of data, being able to construct different levels of aggregation is really important, because you want to make sure you've used your software intelligently with respect to that large amount of data, and bring to bear the contextual data you need to answer the question at the level of aggregation that you need to answer it.",Fiona Roddis,Analytics
130,"If statistics are boring, you've got the wrong numbers",Jeff Allen,Analytics
131,Data are just summaries of thousands of stories – tell a few of those stories to help make the data meaningful.,Jeff Sauer,Analytics
132,"[A data-first strategy] is the quest to implement systems (usually massive) to collect data of all shapes and manners before all else. [...]It is being hyper-conservative when it comes to creativity and experimentation because of quant-issues. It is represented by 90% of the data budget invested in Agencies and Consultants driving implementation and re-implementation and hyper-customization of the code. It is represented by the act of creating crazy data thresholds for any initiative to get off the ground. [...]  Data is important. I believe it can help drive your business strategy smartly. But, a data-first strategy, defined as above, is nuts. It will only slow down your progress and allow your competitors to crush you like a bug (even if you are a top player in your market today!).You can have data without information, but you cannot have information without data.",Tom Conrad,Analytics
133,"A screen full of analytics data looks like a secret code, and in a way it is. That data has a lot of information in it, and it's impossible to make sense of it without the key. Put another way, data can give answers, but only if you ask the right questions.""",Julie Zhuo,Analytics
134,"The key is to let computers do what they are good at, which is trawling these massive data sets for something that is mathematically odd, and that makes it easier for humans to do what they are good at — explain those anomalies.",Monica Rogati,Analytics
135,Data is a precious thing and will last longer than the systems themselves.,Mark Andreessen,Analytics
136,"""One metric alone doesn't tell you what's happening with your site; as ever Analytics is about taking your data and outside influences (i.e. time of year) and building insights from all of it.",Sean Ellis,Analytics
137,"In a marketing analytics worldview, companies must have an accounting of and insight into all of their marketing programs in all of their channels, including web/browser, mobile apps, TV/video, social, paid media, field, print, outdoor and others. If your organization is still stuck in the web analytics mindset, it is time to reinvent your analytics practice, leveraging all of the available marketing analytics tools to make faster and better decisions and drive your business.",Daniel Wolchonok,Analytics
